{
  "schema": "sigil.registration/v2",
  "owner_public_key": "e28b7f9e9f75ce21223703774ee3ffb8bbade011bb674521c9658dc1786677b9",
  "pk_hash": "10557720968573965342392388716199003360260180289581770851761209578987792373887",
  "config": {
    "protocol": 2,
    "T": 64,
    "M": 288,
    "layer": "conv2",
    "scale_bits": 16,
    "w_bits": 24,
    "max_err": 8,
    "norm": "none",
    "prg_bits": 200
  },
  "config_hash": "15271129699624883643617381122826526107408270685721458958957380929102354020351",
  "commitment": "14475661460362725281066963650847473165930083274232007953091326006909907545690",
  "model_sha256": "c3e94aff7dd74fc2865ce607336d15c42a0c93fef778f9c2cac309be23ae3ac6",
  "created_at": "2026-10-04T21:43:17Z",
  "owner_signature": "7HdryiQOUw6yldWdFkq/u1uWHi4qrWKdqVuooZj7Tb1cDJIdqKFc0qBfRjMjqezPkK+oa4SuhkiqK6k/IyxTBg=="
}